{
  "$schema": "https://json-schema.org/draft/2020-12/schema",
  "$id": "https://schemas.corcept.dev/corcept-hook-input-v1.schema.json",
  "title": "CORCEPT Hook Input v1",
  "type": "object",
  "required": ["hook_event_name"],
  "properties": {
    "session_id": { "type": "string" },
    "transcript_path": { "type": "string" },
    "cwd": { "type": "string" },
    "permission_mode": { "type": "string" },
    "hook_event_name": { "type": "string" },
    "tool_name": { "type": "string" },
    "tool_input": { "type": "object" },
    "tool_response": {},
    "tool_use_id": { "type": "string" },
    "prompt": { "type": "string" },
    "stop_hook_active": { "type": "boolean" },
    "agent_id": { "type": "string" },
    "agent_type": { "type": "string" },
    "delegation": {
      "$ref": "https://schemas.corcept.dev/corcept-delegation-v1.schema.json"
    }
  },
  "allOf": [
    {
      "if": { "required": ["delegation"] },
      "then": {
        "required": ["cwd", "session_id", "tool_use_id", "tool_name", "tool_input"],
        "properties": {
          "hook_event_name": { "const": "PreToolUse" },
          "cwd": { "minLength": 1, "description": "Absolute native path; the admission gate binds it to the selected project root." },
          "session_id": { "$ref": "https://schemas.corcept.dev/corcept-delegation-v1.schema.json#/$defs/opaqueReference" },
          "tool_use_id": { "$ref": "https://schemas.corcept.dev/corcept-delegation-v1.schema.json#/$defs/opaqueReference" },
          "tool_name": { "$ref": "https://schemas.corcept.dev/corcept-delegation-v1.schema.json#/$defs/opaqueReference" },
          "agent_id": { "$ref": "https://schemas.corcept.dev/corcept-delegation-v1.schema.json#/$defs/opaqueReference" }
        }
      }
    }
  ],
  "additionalProperties": true
}
